B2: FY2324南区半年度生意回顾&表彰大会
B3: 时间：2023.11.16-17日
B4: 地址：广东清远
B5: 会议地点：清远市清新区环城中路8号清新花园酒店
B6: 参会人员：大区职能、成本中心负责人、办事处负责人、客户组主任
B8: 会议议程:
B9: 会议日期 | C9: 时间 | F9: 时长 | G9: 主题 | H9: 负责人 | I9: 备注
B10: 45245. | C10: 下午/晚 | D10: / | E10: / | F10: / | G10: 全体参会人员到达会议酒店办理入住 | H10: 会务组工作人员 | I10: 住宿走各自差旅
B11: 45246. | C11: 上午 | D11: 0.375 | E11: =D11+F11 -> 0.38194444444444442 | F11: 6.9444444444444441e-003 | G11: 姚总开场寄语 | H11: 姚总 | I11: 会议室：花园厅
D12: =E11 -> 0.38194444444444442 | E12: =D12+F12 -> 0.40277777777777773 | F12: 2.0833333333333332e-002 | G12: 林总分享 | H12: 林总
D13: =E12 -> 0.40277777777777773 | E13: =D13+F13 -> 0.41666666666666663 | F13: 1.3888888888888888e-002 | G13: RTM分享 | H13: LEO
D14: =E13 -> 0.41666666666666663 | E14: =D14+F14 -> 0.43055555555555552 | F14: 1.3888888888888888e-002 | G14: TM分享 | H14: 彭翠梅
D15: =E14 -> 0.43055555555555552 | E15: =D15+F15 -> 0.44097222222222221 | F15: 1.0416666666666666e-002 | G15: 广州战区半年度回顾&下半年工作重点 | H15: 李军雄
D16: =E15 -> 0.44097222222222221 | E16: =D16+F16 -> 0.44791666666666663 | F16: 6.9444444444444441e-003 | G16: 休息
D17: =E16 -> 0.44791666666666663 | E17: =D17+F17 -> 0.45833333333333331 | F17: 1.0416666666666666e-002 | G17: 深惠战区半年度回顾&下半年工作重点 | H17: 肖慧深
D18: =E17 -> 0.45833333333333331 | E18: =D18+F18 -> 0.46875 | F18: 1.0416666666666666e-002 | G18: 珠三角战区半年度回顾&下半年工作重点 | H18: 石蔚
D19: =E18 -> 0.46875 | E19: =D19+F19 -> 0.47916666666666669 | F19: 1.0416666666666666e-002 | G19: 佛肇战区半年度回顾&下半年工作重点 | H19: 吴华清
D20: =E19 -> 0.47916666666666669 | E20: =D20+F20 -> 0.48958333333333337 | F20: 1.0416666666666666e-002 | G20: 南二战区半年度回顾&下半年工作重点 | H20: 何庆佳
D21: =E20 -> 0.48958333333333337 | E21: =D21+F21 -> 0.5 | F21: 1.0416666666666666e-002 | G21: 大合照 | H21: 黎玉燕+工作人员 | I21: 户外取景
C22: 午餐 | D22: =E21 -> 0.5 | E22: =D22+F22 -> 0.57291666666666663 | F22: 7.2916666666666671e-002 | G22: 自助午餐 | H22: ALL
C23: 下午 | D23: =E22 -> 0.57291666666666663 | E23: =D23+F23 -> 0.58680555555555547 | F23: 1.3888888888888888e-002 | G23: 乘坐会务大巴前往清新体育馆 | H23: 刘燕妮/李伟/谢宇政/莫介勇 | I23: 地点：清新体育馆室内羽毛球/篮球场
D24: =E23 -> 0.58680555555555547 | E24: =D24+F24 -> 0.6597222222222221 | F24: 7.2916666666666671e-002 | G24: 南区第一届运动会（篮球/羽毛球同时进行） | H24: 李伟/谢宇政
D25: =E24 -> 0.6597222222222221 | E25: =D25+F25 -> 0.70138888888888873 | F25: 4.1666666666666664e-002 | G25: 拔河比赛 | H25: 莫介勇 | I25: 地点：清新体育馆室外篮球场
D26: =E25 -> 0.70138888888888873 | E26: =D26+F26 -> 0.71527777777777757 | F26: 1.3888888888888888e-002 | G26: 乘坐会务大巴回酒店 | H26: 刘燕妮/李伟/谢宇政/莫介勇
D27: =E26 -> 0.71527777777777757 | E27: =D27+F27 -> 0.74999999999999978 | F27: 3.4722222222222224e-002 | G27: 休息洗漱 | H27: ALL
C28: 晚 | D28: =E27 -> 0.74999999999999978 | E28: =D28+F28 -> 0.87499999999999978 | F28: 0.125 | G28: 晚宴 | H28: ALL | I28: 地点：花园厅
B30: 45247. | C30: 上午 | D30: 0.35416666666666669 | E30: =D30+F30 -> 0.375 | F30: 2.0833333333333332e-002 | G30: 乘坐会务大巴前往拓展基地 | H30: 刘燕妮/李伟/谢宇政/莫介勇
D31: =E30 -> 0.375 | E31: =D31+F31 -> 0.45833333333333331 | F31: 8.3333333333333329e-002 | G31: 拓展活动 | H31: 专业拓展公司
D32: =E31 -> 0.45833333333333331 | E32: =D32+F32 -> 0.47916666666666663 | F32: 2.0833333333333332e-002 | G32: 大合照 | H32: 黎玉燕
D33: =E32 -> 0.47916666666666663 | E33: =D33+F33 -> 0.49999999999999994 | F33: 2.0833333333333332e-002 | G33: 乘坐会务大巴回酒店 | H33: 刘燕妮/李伟/谢宇政/莫介勇
D34: =E33 -> 0.49999999999999994 | E34: =D34+F34 -> 0.54166666666666663 | F34: 4.1666666666666664e-002 | G34: 自助午餐 | H34: ALL | I34: 午餐后各自回程
B36: 45247. | E36: 大巴发车时间 | F36: 0.53125 | G36: 会务大巴前往高铁站（清远站），请大家按需要决定是否乘坐
F37: 0.54513888888888895 | G37: 会务大巴前往高铁站（清远站），请大家按需要决定是否乘坐
F38: 0.55902777777777779 | G38: 会务大巴前往高铁站（清远站），请大家按需要决定是否乘坐
F39: 0.57291666666666663 | G39: 会务大巴前往高铁站（清远站），请大家按需要决定是否乘坐